{
  "name": "Fourth Coffee",
  "description": "A sample ontology representing a modern coffee shop chain with suppliers, products, stores, customers, and orders.",
  "icon": "☕",
  "category": "retail",
  "tags": [
    "coffee",
    "supply-chain",
    "fabric-iq",
    "demo"
  ],
  "author": "ontology-quest",
  "nameKo": "포스 커피",
  "descriptionKo": "공급업체, 상품, 매장, 고객, 주문을 아우르는 현대적 커피숍 체인을 모델링한 샘플 온톨로지입니다."
}
